{"batch":2,"config":{"core_fmt":"ternary","ctx":8,"d":8,"d_ff":8,"delta":0.5,"emb_fmt":"4bit","mlp":"gelu","n_heads":2,"n_layers":1,"qk_norm":false,"scale_policy":"row16","vocab":256},"lr":0.003,"schema":"floppylm.e0.fixture.v1","targets":[32,116,104,101,32,109,97,116,32,115,97,116,32,111,110,32],"tensors":[{"cols":8,"name":"emb.weight","norm":false,"rows":256,"values":[0.5482696890830994,0.22939130663871765,0.009650527499616146,-0.14421674609184265,0.2434099167585373,0.15093904733657837,-0.33407506346702576,0.05562184751033783,-0.751439094543457,-0.05589006468653679,0.7278892397880554,0.5005203485488892,0.040330175310373306,0.0946010947227478,0.02521035633981228,0.033345989882946014,-0.241843119263649,-0.0010423471685498953,0.5066474080085754,-0.3634866774082184,0.21469810605049133,-0.26860129833221436,0.3818970024585724,0.26649409532546997,-0.39942237734794617,0.04070513695478439,-0.2642987072467804,-0.09285765141248703,0.18646059930324554,0.18628284335136414,-0.2331315129995346,-0.08894825726747513,-0.8225653767585754,-0.9970094561576843,0.06974250078201294,0.08170682936906815,0.13834168016910553,-0.36929354071617126,-0.13484613597393036,0.3918282091617584,0.16039001941680908,-0.0917089506983757,0.3312232196331024,0.23759829998016357,0.003152247052639723,0.1472240537405014,-0.20327506959438324,0.6815370917320251,-0.3747679889202118,-0.5189691781997681,-0.38928350806236267,-0.3696618676185608,-0.49293655157089233,0.15550579130649567,-0.08027151972055435,-0.16003349423408508,0.1803809404373169,0.19848564267158508,-0.28383979201316833,0.16651305556297302,-0.29325568675994873,-0.09035490453243256,-0.061277806758880615,-0.12656715512275696,-0.0316644012928009,0.002004093024879694,-0.011108090169727802,-0.5026465058326721,-0.3067197799682617,-0.09035000950098038,0.22385069727897644,-0.06377006322145462,-0.32956090569496155,-0.2641277015209198,0.6147592067718506,-0.2919672429561615,0.46533963084220886,0.48770543932914734,0.047302670776844025,0.36291903257369995,-0.29201674461364746,-0.18712829053401947,0.47268202900886536,-0.7779297232627869,-0.09848684817552567,-0.5439335107803345,0.2769172787666321,0.45725899934768677,0.0796157717704773,-0.05402400344610214,0.039092011749744415,-0.3826759159564972,0.5013568997383118,-0.015569603070616722,0.34432119131088257,-0.47405362129211426,0.02222316898405552,-0.4019968509674072,-0.5044121742248535,-0.566256582736969,-0.1984056681394577,0.9435515999794006,0.03040820173919201,0.3096241056919098,-0.2767959535121918,-0.5227570533752441,0.15243308246135712,0.07189695537090302,-0.5356824994087219,-0.6923863291740417,0.24259443581104279,0.031947799026966095,0.3146069049835205,0.01343325711786747,-0.03368184342980385,-0.020973796024918556,-0.7588622570037842,0.08027870208024979,-0.02553139626979828,-0.29154038429260254,-0.1462380439043045,-0.2928975522518158,-0.2353094071149826,0.38692501187324524,0.2613135874271393,-0.27901598811149597,-0.03346715867519379,0.38761839270591736,0.3062793016433716,0.05883747711777687,-0.16415615379810333,-0.0971674844622612,-0.1682276874780655,-0.25552621483802795,0.07614792883396149,-0.3366885185241699,0.8793583512306213,-0.11232045292854309,-0.4489620327949524,0.4760071337223053,-0.1352074295282364,-0.4662795662879944,0.4299558103084564,-0.03713895380496979,-0.3204209506511688,-0.1848311722278595,0.474027156829834,0.11557557433843613,0.30534130334854126,-0.23790894448757172,-0.618965208530426,0.034639984369277954,-0.17588232457637787,0.5189027190208435,-0.0784333273768425,-0.08368504047393799,0.11022166907787323,0.3013431131839752,0.23276787996292114,-0.006546559277921915,0.04897348955273628,0.26687121391296387,0.11971058696508408,-0.2793187201023102,0.4238395690917969,0.20017841458320618,0.09618345648050308,0.04857062175869942,-0.14163778722286224,-0.6020482778549194,-0.8501220941543579,-0.06407909840345383,-0.2784360647201538,0.13486307859420776,0.3608364760875702,-0.6100366711616516,0.46688714623451233,-0.31623807549476624,0.1274329572916031,-0.46517884731292725,0.29334723949432373,0.24741065502166748,-0.10721945017576218,-0.03767768293619156,0.2383577525615692,0.14661705493927002,0.3688524663448334,-0.5149374008178711,0.2695480287075043,0.14686176180839539,-0.3427896797657013,0.08582229167222977,0.3217723071575165,-0.3039943277835846,0.47511377930641174,0.04890379309654236,-0.09048768132925034,0.04854753240942955,0.05199161916971207,0.11578769236803055,0.35914963483810425,0.3572924733161926,0.20299167931079865,0.021413462236523628,0.6358649134635925,-0.559432327747345,-0.012748082168400288,-0.0756617859005928,0.5894479155540466,0.39189398288726807,-0.1217726320028305,0.12956960499286652,-0.011224960908293724,0.18415124714374542,0.25366824865341187,-0.022648584097623825,-0.0941987931728363,-0.04090528190135956,-0.4331316351890564,-0.05164875090122223,0.4195188581943512,-0.41558489203453064,0.4044637978076935,-0.09201084822416306,0.08359459787607193,-0.14716753363609314,-0.3573407828807831,-0.23919595777988434,-0.013946020975708961,0.2702094316482544,-0.05076003447175026,0.3512267470359802,-0.14201274514198303,-0.2723413109779358,0.08635032922029495,0.25788557529449463,0.2760854661464691,0.3545430302619934,0.3300402760505676,0.2628104090690613,-0.15526950359344482,-0.07868831604719162,0.32571473717689514,-0.6363692879676819,-0.19312787055969238,-0.037122275680303574,-0.4713727831840515,0.020168140530586243,0.4327777028083801,0.2913922071456909,0.46629801392555237,0.3774375319480896,-0.004000311717391014,-0.004760072100907564,0.5090261697769165,0.27515581250190735,-0.4018573760986328,0.06451039761304855,-0.07834824919700623,0.21789972484111786,-0.12517060339450836,0.20340527594089508,-0.6837080121040344,0.27139538526535034,-0.029553892090916634,0.026464946568012238,-0.008555231615900993,-0.40396231412887573,0.49390849471092224,-0.571238100528717,0.009047613479197025,0.26529812812805176,0.3468934893608093,-0.1092865988612175,-0.4716794788837433,0.5331562757492065,0.7334648370742798,0.5995970964431763,0.30125924944877625,0.5860034823417664,0.24951405823230743,-0.012669321149587631,0.152150958776474,-0.09134607762098312,0.5961518883705139,0.03756516054272652,-0.04039013758301735,0.20412342250347137,-0.2714717984199524,0.08911100775003433,-0.1419014036655426,-0.6640319228172302,0.4449290633201599,-0.13085511326789856,-0.11676564067602158,-0.325989305973053,-0.9387508034706116,0.43324849009513855,0.6690093278884888,-0.20014075934886932,0.04878109320998192,-0.5078018307685852,0.4116794168949127,0.047774601727724075,0.29109475016593933,-0.43264320492744446,-0.2602823078632355,-0.0010179276578128338,-0.15246142446994781,0.30803608894348145,0.17087501287460327,-0.24514460563659668,0.010615328326821327,0.6232441067695618,-0.014361638575792313,0.5781553387641907,0.004981476813554764,0.17120128870010376,-0.2084198296070099,0.5861532688140869,0.29923972487449646,0.20632095634937286,0.6835665702819824,0.3135448396205902,1.0702348947525024,-0.13095170259475708,0.2521842420101166,-0.1551985889673233,-0.5359913110733032,-0.08332956582307816,0.48713424801826477,0.17771296203136444,-0.1812310814857483,0.5067213773727417,-0.4591790735721588,0.179685577750206,0.5906578898429871,-0.27793461084365845,-0.27571937441825867,0.26709288358688354,0.13726060092449188,0.09713716059923172,-0.15749318897724152,0.0581585094332695,0.28963106870651245,0.20071475207805634,-0.021205859258770943,-0.19884242117404938,-0.12283404916524887,0.1538686752319336,0.3636907637119293,0.21025162935256958,0.28147372603416443,-0.09100718051195145,0.16817939281463623,-0.3243739902973175,0.03617987781763077,0.19484058022499084,-0.1731976866722107,0.13164955377578735,0.00026574850198812783,-0.03154504671692848,0.8928596377372742,0.20833180844783783,-0.1662432700395584,-0.25322088599205017,0.6605960130691528,-0.0013369505759328604,0.20874318480491638,-0.06908135861158371,0.06852120906114578,0.7908788323402405,0.6312719583511353,0.4580687880516052,-0.14347422122955322,0.2929615080356598,-0.2959643602371216,-0.1737147867679596,-0.20761045813560486,-0.6259682178497314,0.13317476212978363,-0.005001159850507975,-0.17645923793315887,0.3573281764984131,0.008289370685815811,0.09147873520851135,0.3357295095920563,-0.7549130320549011,-0.8535627722740173,0.27907001972198486,0.09378993511199951,0.049056701362133026,0.4094781279563904,0.015727953985333443,-0.05986518785357475,-0.0995248481631279,-0.1374601423740387,-0.691180408000946,-0.1916772723197937,0.3370891213417053,-0.062350913882255554,0.2253861427307129,0.05797884240746498,-0.3242734968662262,-0.20172548294067383,0.6381352543830872,0.732234537601471,0.10501322150230408,0.32503679394721985,-0.098185233771801,-0.5090838074684143,-0.08273634314537048,0.5213516354560852,0.06514766812324524,-0.16823963820934296,-0.2587561011314392,0.3534075617790222,-0.15296459197998047,-0.2097732126712799,0.23998364806175232,-0.03798775374889374,-0.1845153570175171,0.35500091314315796,-0.16898049414157867,0.12190800905227661,0.010867889039218426,-0.2147063910961151,0.3987342119216919,-0.001500402227975428,-0.4324251115322113,-0.11005841195583344,0.6397061347961426,0.3184018135070801,0.5547316074371338,0.3505971133708954,-0.1283200979232788,-0.08567807823419571,0.6020467281341553,0.04748007655143738,0.530150830745697,0.19370152056217194,0.507541298866272,-0.3852500021457672,-0.0440719909965992,-0.3667706847190857,-0.19590885937213898,-0.16731947660446167,0.2189662605524063,-0.41856661438941956,-0.05162125453352928,-0.16292285919189453,0.1520932912826538,0.47603246569633484,-0.1872452050447464,-0.1155724972486496,-0.1775483787059784,0.9535825252532959,-0.19402626156806946,0.18929710984230042,-0.0309000201523304,0.08018364757299423,-0.2117617428302765,0.14701522886753082,0.4808972179889679,-0.11085794866085052,-0.6438852548599243,0.2507239580154419,0.013153498992323875,-0.06859960407018661,-0.23324429988861084,0.17695309221744537,-0.1750725954771042,0.5044827461242676,-0.32937493920326233,0.569779634475708,-0.02232172153890133,-0.6351672410964966,-0.9986010193824768,-0.03889073